{
  "$schema": "./god-files.schema.json",
  "schema": "symphony.architecture.god-files.v1",
  "notes": [
    "SYMPH-1073 report-only window opened 2026-07-09. Review observed PR results on 2026-07-23 before proposing blocking enforcement.",
    "Line pins are regenerated by scripts/architecture/check-god-files.mjs --update-pins, which only lowers max_lines and is the repair path for stale-high pins.",
    "Full-set auditing runs on pushes to main and reports both actual > pin and pin > actual.",
    "Pin raises require origin/main evidence that the committed pin is already stale-low. New PR growth must extract, hold flat, or use a temporary expiring waiver."
  ],
  "pinned_files": [
    {
      "path": "src/orchestrator/core.ts",
      "max_lines": 15615,
      "forbidden_new_patterns": []
    },
    {
      "path": "src/orchestrator/runtime-host.ts",
      "max_lines": 9651,
      "forbidden_new_patterns": []
    },
    {
      "path": "src/review/headless-council-gate.ts",
      "max_lines": 7272,
      "forbidden_new_patterns": []
    }
  ],
  "waivers": [
    {
      "path": "src/orchestrator/core.ts",
      "rule": "god_file.max_lines",
      "reason": "SYMPH-1108/1109 journal commit boundary; extraction tracked by SYMPH-1122",
      "expires": "2026-08-15"
    },
    {
      "path": "src/orchestrator/runtime-host.ts",
      "rule": "god_file.max_lines",
      "reason": "SYMPH-1109 authenticated grade routing; extraction tracked by SYMPH-1122",
      "expires": "2026-08-15"
    }
  ]
}
